{
   "MATNR": "3VA61105KM310AA0",
   "ZDXG_YYBCEZNDR": "3VA6110-5KM31-0AA0",
   "ZDXG_YYBCEZNSO": "3VA61105KM310AA0",
   "ZDXG_YYKURZANGA": "K0Y",
   "VKORG": "RGSE",
   "CH_CLUST_KOND": {
      "ZLP0_1000": {
         "KSCHL": "ZLP0",
         "KOTABNR": "502",
         "VTWEG": "00",
         "#############": "Nur aktueller Preis",
         "DATBI": "99991231",
         "DATAB": "20240703",
         "KSTBM": "           1.000",
         "KBETR": "       10.00",
         "KONWA": "EUR",
         "KPEIN": "    1",
         "KMEIN": "ST",
         "ZDXG_DATA_ORIGIN": "R"
      },
      "ZLP0_RG": {
         "KSCHL": "ZLP0",
         "KOTABNR": "502",
         "VTWEG": "00",
         "#############": "Nur aktueller Preis",
         "DATBI": "99991231",
         "DATAB": "20240108",
         "KSTBM": "           1.000",
         "KBETR": "    24500.00",
         "KONWA": "SEK",
         "KPEIN": "    1",
         "KMEIN": "ST",
         "ZDXG_DATA_ORIGIN": "R"
      }
   },
   "CH_CLUST_MARD": {
      "N001": {
         "WERKS": "RGSE",
         "ZDXG_LIFNR": "AC008110",
         "ZDXG_LIFZ": " 33",
         "ZDXG_MINBM": "         1.000",
         "ZDXG_NORBM": "         0.000",
         "ZDXG_MAXBM": "         9.000",
         "ZDXG_STFBM": "         1.000",
         "ZDXG_VPART": "SZ",
         "ZDXG_VPMNO": "         1.000",
         "ZDXG_VPMGR": "         0.000",
         "ZDXG_VPMEH": "ST",
         "ZDXG_DATA_ORIGIN": "R",
         "LAND1": "DE",
         "ZDXG_VLIEF": "X",
         "ZDXG_GENFLAG": "X"
      },
      "N002": {
         "WERKS": "RGSE",
         "ZDXG_LIFNR": "AC008110",
         "ZDXG_LIFZ": " 44",
         "ZDXG_MINBM": "        10.000",
         "ZDXG_NORBM": "         0.000",
         "ZDXG_MAXBM": "         0.000",
         "ZDXG_STFBM": "         1.000",
         "ZDXG_VPART": "SZ",
         "ZDXG_VPMNO": "         1.000",
         "ZDXG_VPMGR": "         0.000",
         "ZDXG_VPMEH": "ST",
         "ZDXG_LIFZ_AA": "X",
         "ZDXG_DATA_ORIGIN": "R",
         "LAND1": "DE",
         "ZDXG_GENFLAG": "X"
      }
   },
   "CH_CLUST_MEAN": {
      "HE": {
         "EAN11": "4042948851418",
         "EANTP": "HE",
         "HPEAN": "X"
      },
      "UC": {
         "EAN11": "804766306914",
         "EANTP": "UC"
      }
   },
   "CH_CLUST_MARA": {
         "MTART": "FERT",
         "MBRSH": "M",
         "MATKL": "KHD",
         "MEINS": "ST",
         "BRGEW": "        20.000",
         "NTGEW": "        10.000",
         "GEWEI": "G",
         "SPART": "01",
         "EXTWG": "SIEP",
         "ZDXG_SORT_02": "PS50021",
         "ZDXG_SORT_04": "10.00%",
         "ZDXG_FDBGT": "00000000",
         "ZDXG_ABGEB": "SSI",
         "ZDXG_VERANTW": "1000",
         "ZDXG_VERTRIEB": "X",
         "ZDXG_YYLASTUPD": "00000000",
         "ZDXG_YYMASCH": "A",
         "ZDXG_DATA_ORIGIN": "R",
         "ZDXG_0007": "X",
         "ZDXG_YYBCNORM": "F",
         "ZDXG_SWPFV": "0",
         "ERSDA": "20151130",
         "LAEDA": "20240704",
         "ZDXS_MARA_EXT1": {
            "ZDXG_PRODIS": "1",
            "ZDXG_TECH_PRDGR": "3VA6",
            "ZDXG_MHAFR": "00",
            "LAENGE": "         0.000",
            "BREITE": "         0.000",
            "HOEHE": "         0.000",
            "ZDXG_SENDE_ORGID": "A1103478",
            "ZDXG_PRODV": "1000",
            "ZDXG_FUEHRSPR": "D",
            "ZDXG_FUEHRSPR_LAISO": "DE",
            "ZDXG_GG_FLAG": "I",
            "ZDXG_GG_HINW": "Weitere Infos siehe SIOS"
         }
   },
   "CH_CLUST_MVKE":
      {
          "VTWEG": "00",
          "SKTOF": "X",
          "VMSTA": "LF",
          "VMSTD": "20150316",
          "ZDXG_VGBK": "R711",
          "ZDXG_VFGRP": "5452",
          "ZDXG_LKZ01": "CC-IC10",
          "ZDXG_LKZ19": "EMS",
          "ZDXG_PRKLA": "D",
          "ZDXG_EGHID": "0",
          "ZDXG_PRGRP_GG": "41J",
          "ZDXG_MALL": "0",
          "ZDXG_RGGEW": "         0.000",
          "ZDXG_M50FI": "00000000",
          "ZDXG_M55PA": "20140430",
          "ZDXG_M65VF": "20141001",
          "ZDXG_M80LF": "20150316",
          "ZDXG_M90AE": "00000000",
          "ZDXG_M91TS": "00000000",
          "ZDXG_M99MH": "00000000",
          "ZDXG_M100AK": "00000000",
          "ZDXG_BSPER": "00000000",
          "ZDXG_M55PA_FREI": "X",
          "ZDXG_M65VF_FREI": "X",
          "ZDXG_M80LF_FREI": "X",
          "ZDXG_DATA_ORIGIN": "R",
          "ZDXG_TIEFG": "SSI0478110",
          "ZDXG_MALLDQ": "G",
          "ZDXG_BWARN": "00000000",
          "ZDXG_PRAUSG": "0",
          "ZDXG_DIV02L": "SI EP"
      }
}
